Year1;Year;Date; ;Version;RELEASE;Changes;By; ;Type;General;General Category;;;;;;;;;;;;;;;;;;;
+18 years;2023;03.06.2023;2.13.;2.13.0;MINOR;;;;;;;;;;;;;;;;;;;;;;;;;
+18 years;2023;03.06.2023;2.13.;2.13.0;MINOR;Regression in FileUtils.touch() - no longer creates parent directories. Fixes IO-791. Thanks to Chad Wilson, Gary Gregory.;ggregory;;;Fix regression;Bug fix;;;;;;;;;;;;;;;;;;;
+18 years;2023;03.06.2023;2.13.;2.13.0;MINOR;ByteArrayOrigin should be able convert a byte[] to a ByteArrayInputStream. Thanks to Gary Gregory.;ggregory;;;Fix wrong implementation;Bug fix;;;;;;;;;;;;;;;;;;;
+18 years;2023;03.06.2023;2.13.;2.13.0;MINOR;AbstractOriginSupplier.checkOrigin() now throws IllegalStateException instead of NullPointerException. Thanks to Gary Gregory.;ggregory;;;Fix throwing wrong exception;Bug fix;;;;;;;;;;;;;;;;;;;
+18 years;2023;03.06.2023;2.13.;2.13.0;MINOR;FileAlreadyExistsException in PathUtils.createParentDirectories(Path, LinkOption, FileAttribute...). Fixes IO-796. Thanks to Giacomo Boccardo, Gary Gregory.;ggregory;exception;FileAlreadyExistsException;Handle exception;Bug fix;;;;;;;;;;;;;;;;;;;
+18 years;2023;03.06.2023;2.13.;2.13.0;MINOR;Only read the relevant portion of a file in AbstractOrigin.FileOrigin.getByteArray(long, int) Thanks to Gary Gregory.;ggregory;;;Fix wrong implementation;Bug fix;;;;;;;;;;;;;;;;;;;
+18 years;2023;03.06.2023;2.13.;2.13.0;MINOR;Only read the relevant portion of a file in AbstractOrigin.PathOrigin.getByteArray(long, int) Thanks to Gary Gregory.;ggregory;;;Fix wrong implementation;Bug fix;;;;;;;;;;;;;;;;;;;
+18 years;2023;03.06.2023;2.13.;2.13.0;MINOR;DeferredFileOutputStream throws exception when system temp dir is a symlink. Fixes IO-798. Thanks to Shai Shapira, Gary Gregory.;ggregory;exception;FileAlreadyExistsException;Handle exception;Bug fix;;;;;;;;;;;;;;;;;;;
+18 years;2023;03.06.2023;2.13.;2.13.0;MINOR;ReaderInputStream.Builder.setCharsetEncoder(null) should reset to a default object, not throw an NPE. Thanks to Gary Gregory.;ggregory;exception;NullPointerException;Handle exception;Bug fix;;;;;;;;;;;;;;;;;;;
+18 years;2023;03.06.2023;2.13.;2.13.0;MINOR;ReaderInputStream.Builder.setCharset(null) should reset to a default object, not throw an NPE. Thanks to Gary Gregory.;ggregory;exception;NullPointerException;Handle exception;Bug fix;;;;;;;;;;;;;;;;;;;
+18 years;2023;03.06.2023;2.13.;2.13.0;MINOR;Add CharSequenceInputStream.Builder. Thanks to Gary Gregory.;ggregory;;;Add class;Add support for a new feature;;;;;;;;;;;;;;;;;;;
+18 years;2023;03.06.2023;2.13.;2.13.0;MINOR;Add ChunkedOutputStream.Builder. Thanks to Gary Gregory.;ggregory;;;Add class;Add support for a new feature;;;;;;;;;;;;;;;;;;;
+18 years;2023;03.06.2023;2.13.;2.13.0;MINOR;Add AbstractStreamBuilder.setOpenOptions(OpenOption...). Thanks to Gary Gregory.;ggregory;;;Add method;Add support for a new feature;;;;;;;;;;;;;;;;;;;
+18 years;2023;03.06.2023;2.13.;2.13.0;MINOR;Add some missing conversions to AbstractOrigin subclasses. Thanks to Gary Gregory.;ggregory;;Add missing conversions to subclasses;Add functionality;Add support for a new feature;;;;;;;;;;;;;;;;;;;
+18 years;2023;03.06.2023;2.13.;2.13.0;MINOR;Add AbstractOrigin.getByteArray(long, int). Thanks to Gary Gregory.;ggregory;;;Add method;Add support for a new feature;;;;;;;;;;;;;;;;;;;
+18 years;2023;03.06.2023;2.13.;2.13.0;MINOR;Add and use RandomAccessFiles. Thanks to Gary Gregory.;ggregory;;;Add class;Add support for a new feature;;;;;;;;;;;;;;;;;;;
+18 years;2023;03.06.2023;2.13.;2.13.0;MINOR;Add AbstractOrigin.size(). Thanks to Gary Gregory.;ggregory;;;Add method;Add support for a new feature;;;;;;;;;;;;;;;;;;;
+18 years;2023;03.06.2023;2.13.;2.13.0;MINOR;Add PathUtils.EMPTY_FILE_ATTRIBUTE_ARRAY. Thanks to Gary Gregory.;ggregory;;;Add constants/variables;Add support for a new feature;;;;;;;;;;;;;;;;;;;
+18 years;2023;03.06.2023;2.13.;2.13.0;MINOR;Add CharSequenceInputStream.Builder.setCharsetEncoder(CharsetEncoder). Thanks to Gary Gregory.;ggregory;;;Add method;Add support for a new feature;;;;;;;;;;;;;;;;;;;
+18 years;2023;03.06.2023;2.13.;2.13.0;MINOR;Add CharsetEncoders.toCharsetEncoder(CharsetEncoder, Supplier<CharsetEncoder>). Thanks to Gary Gregory.;ggregory;;;Add method;Add support for a new feature;;;;;;;;;;;;;;;;;;;
+18 years;2023;03.06.2023;2.13.;2.13.0;MINOR;Bump commons-parent from 57 to 58. Thanks to Gary Gregory, Dependabot.;ggregory;;;Bump version numbers;Update dependency;;;;;;;;;;;;;;;;;;;
+18 years;2023;13.05.2023;2.12.;2.12.0;MINOR;;;;;;;;;;;;;;;;;;;;;;;;;
+18 years;2023;13.05.2023;2.12.;2.12.0;MINOR;IOUtils.toByteArray size validation does not match documentation. Fixes IO-697. Thanks to otter606.;kinow;;;Fix conformance to specification;Bug fix;;;;;;;;;;;;;;;;;;;
+18 years;2023;13.05.2023;2.12.;2.12.0;MINOR;Fix Javadoc links to the JRE Javadoc 8. Thanks to Gary Gregory.;ggregory;;Adapt to newer Java version;Fix documentation;Documentation;;;;;;;;;;;;;;;;;;;
+18 years;2023;13.05.2023;2.12.;2.12.0;MINOR;FileWriterWithEncoding for an existing file no longer truncates the file. #251. Fixes IO-744. Thanks to RBRi, Gary Gregory.;ggregory;;;Fix wrong implementation;Bug fix;;;;;;;;;;;;;;;;;;;
+18 years;2023;13.05.2023;2.12.;2.12.0;MINOR;A null Charset or Charset name in FileWriterWithEncoding constructors uses the default Charset. Thanks to Gary Gregory.;ggregory;;;Fix wrong default value;Bug fix;;;;;;;;;;;;;;;;;;;
+18 years;2023;13.05.2023;2.12.;2.12.0;MINOR;Fix usage of assertNotNull #269. Thanks to Davide Angelocola.;ggregory;;Fix usage of assertNotNull;Fix wrong implementation;Bug fix;;;;;;;;;;;;;;;;;;;
+18 years;2023;13.05.2023;2.12.;2.12.0;MINOR;FilenameUtils directoryContains() should handle files with the same prefix #217. Fixes IO-727. Thanks to trungPa, Gary Gregory.;ggregory;;;Fix wrong implementation;Bug fix;;;;;;;;;;;;;;;;;;;
+18 years;2023;13.05.2023;2.12.;2.12.0;MINOR;Drop unnecessary casts and conversions #267. Fixes IO-746. Thanks to Davide Angelocola.;ggregory;;Remove redundant casts and conversions;Code refinement;Performance improvement;;;;;;;;;;;;;;;;;;;
+18 years;2023;13.05.2023;2.12.;2.12.0;MINOR;FileUtils.moveToDirectory() exception documentation and exception message error. Fixes IO-748. Thanks to Dirk Heinrichs, Gary Gregory, Elango Ravi.;ggregory;;Fix JavaDoc;Fix documentation;Documentation;;;;;;;;;;;;;;;;;;;
+18 years;2023;13.05.2023;2.12.;2.12.0;MINOR;-;;;Improve exception message ;Code refactoring;Maintainability improvement;;;;;;;;;;;;;;;;;;;
+18 years;2023;13.05.2023;2.12.;2.12.0;MINOR;ThreadMonitor.sleep(Duration) ignores nanoseconds. Thanks to Gary Gregory.;ggregory;;;Fix wrong implementation;Bug fix;;;;;;;;;;;;;;;;;;;
+18 years;2023;13.05.2023;2.12.;2.12.0;MINOR;Fix Javadoc in ThreadMonitor#run() method. #273. Thanks to Arturo Bernal.;ggregory;;Fix JavaDoc;Fix documentation;Documentation;;;;;;;;;;;;;;;;;;;
+18 years;2023;13.05.2023;2.12.;2.12.0;MINOR;FileUtils.listFiles() does not list matching files if File parameter is a symbolic link. Fixes IO-749. Thanks to haihuiyang, Gary Gregory.;ggregory;;FileUtils.listFiles() does not list matching files if File parameter is a symbolic link;Fix regression;Bug fix;;;;;;;;;;;;;;;;;;;
+18 years;2023;13.05.2023;2.12.;2.12.0;MINOR;Fix typo in Javadocs for FileUtils#convertFileCollectionToFileArray() #276. Thanks to niranjanghule, Gary Gregory.;ggregory;typo;Fix JavaDoc;Fix documentation;Documentation;;;;;;;;;;;;;;;;;;;
+18 years;2023;13.05.2023;2.12.;2.12.0;MINOR;Avoid Code Duplication: Reuse Sleep from ThreadMonitor #66. Thanks to DaGeRe, Gary Gregory.;ggregory;;Code reuse;Code simplification;Maintainability improvement;;;;;;;;;;;;;;;;;;;
+18 years;2023;13.05.2023;2.12.;2.12.0;MINOR;FileUtils.iterateFiles also lists directories. Fixes IO-750. Thanks to Sita Geßner, Sebastian Peters, Gary Gregory.;ggregory;;Fix wrong implementation;Fix regression;Bug fix;;;;;;;;;;;;;;;;;;;
+18 years;2023;13.05.2023;2.12.;2.12.0;MINOR;Wrong exception message in FileUtils.setLastModified(File, File). Fixes IO-721. Thanks to Dirk Heinrichs, Gary Gregory.;ggregory;;Fix exception message ;Fix conformance to specification;Bug fix;;;;;;;;;;;;;;;;;;;
+18 years;2023;13.05.2023;2.12.;2.12.0;MINOR;Infinite loop in ReaderInputStream instead of throwing exception for CodingErrorAction.REPORT. Fixes IO-717. Thanks to Marcono1234, Gary Gregory.;ggregory;;;Fix infinite loop;Bug fix;;;;;;;;;;;;;;;;;;;
+18 years;2023;13.05.2023;2.12.;2.12.0;MINOR;ReaderInputStream enter infinite loop for too small buffer sizes. Fixes IO-716. Thanks to Marcono1234, Gary Gregory.;ggregory;;When buffer size is too small;Fix infinite loop;Bug fix;;;;;;;;;;;;;;;;;;;
+18 years;2023;13.05.2023;2.12.;2.12.0;MINOR;Infinite loop in CharSequenceInputStream.read for 4-byte characters with UTF-8 and 3-byte buffer. Fixes IO-638. Thanks to Thayne McCombs, Gary Gregory.;ggregory;;;Fix infinite loop;Bug fix;;;;;;;;;;;;;;;;;;;
+18 years;2023;13.05.2023;2.12.;2.12.0;MINOR;PathUtils.setReadOnly(Path, boolean, LinkOption...) should add READ_* file attributes when using POSIX. Fixes IO-638. Thanks to Gary Gregory.;ggregory;;;Fix wrong implementation;Bug fix;;;;;;;;;;;;;;;;;;;
+18 years;2023;13.05.2023;2.12.;2.12.0;MINOR;PathUtils.setReadOnly(Path, boolean, LinkOption...) readOnly argument is always assumed true on POSIX. Fixes IO-638. Thanks to Gary Gregory.;ggregory;;;Fix wrong implementation;Bug fix;;;;;;;;;;;;;;;;;;;
+18 years;2023;13.05.2023;2.12.;2.12.0;MINOR;Prevent IllegalArgumentExceptions in BrokenInputStream/Reader/OutputStream/Writer #278. Fixes IO-729. Thanks to Rob Spoor, Gary Gregory.;ggregory;;IllegalArgumentException;Handle exception;Bug fix;;;;;;;;;;;;;;;;;;;
+18 years;2023;13.05.2023;2.12.;2.12.0;MINOR;FileUtils.copyURLToFile(URL, File, int, int) leaks its URLConnection. Called by FileUtils.copyURLToFile(URL, File). Thanks to Gary Gregory.;ggregory;;FileUtils.copyURLToFile(URL, File, int, int) leaks its URLConnection;Fix leaking URLConnection;Security improvement;;;;;;;;;;;;;;;;;;;
+18 years;2023;13.05.2023;2.12.;2.12.0;MINOR;Fixed ReaderInputStream not calling CharsetEncoder.flush issue #283. Fixes IO-714. Thanks to kevinwang1975, Gary Gregory.;ggregory;;;Fix wrong implementation;Bug fix;;;;;;;;;;;;;;;;;;;
+18 years;2023;13.05.2023;2.12.;2.12.0;MINOR;Minor changes #287. Thanks to Arturo Bernal.;ggregory;;Simplify assertions;Code simplification;Maintainability improvement;;;;;;;;;;;;;;;;;;;
+18 years;2023;13.05.2023;2.12.;2.12.0;MINOR;-;;;Remove Unnecessary interface modifier;Code simplification;Maintainability improvement;;;;;;;;;;;;;;;;;;;
+18 years;2023;13.05.2023;2.12.;2.12.0;MINOR;-;;;Replace lambda for reference;Code simplification;Maintainability improvement;;;;;;;;;;;;;;;;;;;
+18 years;2023;13.05.2023;2.12.;2.12.0;MINOR;Update FileWriterWithEncoding to extend ProxyWriter #296. Fixes IO-756. Thanks to wodencafe, Gary Gregory, Bruno P. Kinoshita.;ggregory;;;Change access modifier;Code redesign;;;;;;;;;;;;;;;;;;;
+18 years;2023;13.05.2023;2.12.;2.12.0;MINOR;Initialize the message of an IOExceptionList to a default if null. Thanks to Gary Gregory.;ggregory;;Change default value;Change implementation;Code redesign;;;;;;;;;;;;;;;;;;;
+18 years;2023;13.05.2023;2.12.;2.12.0;MINOR;When deleting symlinks, File/PathUtils.deleteDirectory() changes file permissions of the target. Fixes IO-751. Thanks to Gary Gregory, Richard Cyganiak.;ggregory;;changes file permissions of the target;Fix wrong implementation;Bug fix;;;;;;;;;;;;;;;;;;;
+18 years;2023;13.05.2023;2.12.;2.12.0;MINOR;ReaderInputStream maps null Charset, Charset name, and CharsetEncoder to the platform default instead of throwing a NullPointerException. Thanks to Gary Gregory.;ggregory;;Throw NPE when needed;Fix wrong implementation;Bug fix;;;;;;;;;;;;;;;;;;;
+18 years;2023;13.05.2023;2.12.;2.12.0;MINOR;CharSequenceInputStream maps null Charset and Charset name to the platform default instead of throwing a NullPointerException. Thanks to Gary Gregory.;ggregory;;Throw NPE when needed;Fix wrong implementation;Bug fix;;;;;;;;;;;;;;;;;;;
+18 years;2023;13.05.2023;2.12.;2.12.0;MINOR;WriterOutputStream maps null Charset, Charset name, and CharsetEncoder name to the platform default instead of throwing a NullPointerException. Thanks to Gary Gregory.;ggregory;;Throw NPE when needed;Fix wrong implementation;Bug fix;;;;;;;;;;;;;;;;;;;
+18 years;2023;13.05.2023;2.12.;2.12.0;MINOR;FileUtils.copyURLToFile should create target parent directories and overwrite target file #319. Thanks to Chad Wilson, Gary Gregory.;ggregory;;Broken contract on copyURLToFile in the Javadoc;Fix regression;Bug fix;;;;;;;;;;;;;;;;;;;
+18 years;2023;13.05.2023;2.12.;2.12.0;MINOR;Fix incorrect FilenameUtils Javadoc for null bytes #310. Fixes IO-484. Thanks to Marcono1234, Gary Gregory.;ggregory;;Fix JavaDoc;Fix documentation;Documentation;;;;;;;;;;;;;;;;;;;
+18 years;2023;13.05.2023;2.12.;2.12.0;MINOR;Change to uppercase variable constant. #323. Fixes IO-484. Thanks to Arturo Bernal.;ggregory;;handle embedded null bytes;Fix wrong implementation;Bug fix;;;;;;;;;;;;;;;;;;;
+18 years;2023;13.05.2023;2.12.;2.12.0;MINOR;IOCase.isCaseSensitive(IOCase) result is backward #325. Fixes IO-484. Thanks to David Huang, Gary Gregory.;ggregory;;result is backward;Fix returning wrong output;Bug fix;;;;;;;;;;;;;;;;;;;
+18 years;2023;13.05.2023;2.12.;2.12.0;MINOR;Deprecate PathUtils.NOFOLLOW_LINK_OPTION_ARRAY in favor of noFollowLinkOptionArray(). Fixes IO-758. Thanks to Marcono1234, Gary Gregory.;ggregory;;;Deprecate constant;Deprecate functionality;;;;;;;;;;;;;;;;;;;
+18 years;2023;13.05.2023;2.12.;2.12.0;MINOR;Improve ReaderInputStream documentation #291. Thanks to Marcono1234, Gary Gregory.;ggregory;;Improve JavaDoc;Improve documentation;Documentation;;;;;;;;;;;;;;;;;;;
+18 years;2023;13.05.2023;2.12.;2.12.0;MINOR;Fix misleading comments in FileFilterTest #334. Thanks to richarda23.;ggregory;;Fix misleading comments;Code refactoring;Maintainability improvement;;;;;;;;;;;;;;;;;;;
+18 years;2023;13.05.2023;2.12.;2.12.0;MINOR;Add missing Javadoc for exceptions thrown for invalid arguments #339. Thanks to Diego Marcilio.;ggregory;;Fix JavaDoc;Fix documentation;Documentation;;;;;;;;;;;;;;;;;;;
+18 years;2023;13.05.2023;2.12.;2.12.0;MINOR;FileFilterTest minor fixes #340. Thanks to richarda23.;ggregory;;Fixes a duplicated test line in testAnd with remaining boolean combination;Code simplification;Maintainability improvement;;;;;;;;;;;;;;;;;;;
+18 years;2023;13.05.2023;2.12.;2.12.0;MINOR;-;;;eplaces several Junit4-style tests for exceptions with cleaner junit5 assertThrows() syntax;Change implementation;Code redesign;;;;;;;;;;;;;;;;;;;
+18 years;2023;13.05.2023;2.12.;2.12.0;MINOR;IOUtils.write() throws OutOfMemoryError/NegativeArraySizeException while writing big strings #343. Fixes IO-764. Thanks to DaGeRe, Gary Gregory.;ggregory;;OutOfMemoryError;Handle exception;Bug fix;;;;;;;;;;;;;;;;;;;
+18 years;2023;13.05.2023;2.12.;2.12.0;MINOR;-;;;NegativeArraySizeException;Handle exception;Bug fix;;;;;;;;;;;;;;;;;;;
+18 years;2023;13.05.2023;2.12.;2.12.0;MINOR;Add reserved Windows file names CONIN$ and CONOUT$ to FileSystem #355. Fixes IO-768. Thanks to Marcono1234, Michael Osipov.;ggregory;;Add reserved Windows file names CONIN$ and CONOUT$ to FileSystem;Fix wrong implementation;Bug fix;;;;;;;;;;;;;;;;;;;
+18 years;2023;13.05.2023;2.12.;2.12.0;MINOR;RegexFileFilter is no longer Serializable. Fixes IO-773. Thanks to Dominik Reinarz, Gary Gregory.;ggregory;;RegexFileFilter cannot be serialized;Fix wrong implementation;Bug fix;;;;;;;;;;;;;;;;;;;
+18 years;2023;13.05.2023;2.12.;2.12.0;MINOR;[Javadoc] FileFilterUtils doc does not match impl: missing some file filters. Fixes IO-763. Thanks to Richard Adams, Gary Gregory.;ggregory;;JavaDoc does not match implementation ;Fix documentation;Documentation;;;;;;;;;;;;;;;;;;;
+18 years;2023;13.05.2023;2.12.;2.12.0;MINOR;FileSystem.WINDOWS.isReservedFileName doesn't check for file extension. Fixes IO-762. Thanks to Leonidas Chiron, Gary Gregory.;ggregory;;isReservedFileName doesn't check for file extension;Fix wrong implementation;Bug fix;;;;;;;;;;;;;;;;;;;
+18 years;2023;13.05.2023;2.12.;2.12.0;MINOR;Confusing Javadoc on IOUtils#resourceToURL() and other resource* methods. Fixes IO-772. Thanks to Dan Ziemba, Gary Gregory.;ggregory;;Confusing Javadoc;Clarify documentation;Documentation;;;;;;;;;;;;;;;;;;;
+18 years;2023;13.05.2023;2.12.;2.12.0;MINOR;"FileUtils.copyFile methods throw an unnecessary ""Failed to copy full contents from"" exception. Fixes IO-443. Thanks to Dan Ziemba, Gary Gregory.";ggregory;;"Failed to copy full contents from"" exception";Handle exception;Bug fix;;;;;;;;;;;;;;;;;;;
+18 years;2023;13.05.2023;2.12.;2.12.0;MINOR;Pick up Javadoc from super for override write() methods in AbstractByteArrayOutputStream and ByteArrayOutputStream. Fixes IO-564. Thanks to Hao Zhong, Bernd Eckenfels, Pascal Schumacher, Gary Gregory.;ggregory;;;Fix documentation;Documentation;;;;;;;;;;;;;;;;;;;
+18 years;2023;13.05.2023;2.12.;2.12.0;MINOR;Fix minor typos #367. Thanks to Marc Wrobel.;ggregory;;Fix typos;Stylistic improvement;Maintainability improvement;;;;;;;;;;;;;;;;;;;
+18 years;2023;13.05.2023;2.12.;2.12.0;MINOR;Fix parameters to requireNonNull call in DeferredOutputSteam #368. Fixes IO-776. Thanks to Chris Povirk.;kinow;;DeferredFileOutputStream uses wrong order of parameters in Object.requireNonNull;Fix wrong implementation;Bug fix;;;;;;;;;;;;;;;;;;;
+18 years;2023;13.05.2023;2.12.;2.12.0;MINOR;Fix PathUtils.copyFileToDirectory(URL,Path,CopyOption[]). Thanks to Gary Gregory.;ggregory;;;Fix wrong implementation;Bug fix;;;;;;;;;;;;;;;;;;;
+18 years;2023;13.05.2023;2.12.;2.12.0;MINOR;FileUtils.doCopyFile uses different methods to check the file sizes. Fixes IO-386. Thanks to Sebb, Bernd Eckenfels, zhipengxu, Gary Gregory.;ggregory;;;Fix inconsistency;Bug fix;;;;;;;;;;;;;;;;;;;
+18 years;2023;13.05.2023;2.12.;2.12.0;MINOR;Fix typos #375. Thanks to Michael Ernst.;ggregory;;Fix typos;Stylistic improvement;Maintainability improvement;;;;;;;;;;;;;;;;;;;
+18 years;2023;13.05.2023;2.12.;2.12.0;MINOR;FilenameUtils.normalize javadoc and tests #383. Fixes IO-611. Thanks to Fedor Urvanov.;ggregory;;;Fix wrong implementation;Bug fix;;;;;;;;;;;;;;;;;;;
+18 years;2023;13.05.2023;2.12.;2.12.0;MINOR;-;;;;Fix documentation;Documentation;;;;;;;;;;;;;;;;;;;
+18 years;2023;13.05.2023;2.12.;2.12.0;MINOR;Better docs in IOUtils and IOUtils.byteArray(int size) #374. Fixes IO-611. Thanks to ArdenL-Liu, Bruno P. Kinoshita, Gary Gregory.;ggregory;;;Improve documentation;Documentation;;;;;;;;;;;;;;;;;;;
+18 years;2023;13.05.2023;2.12.;2.12.0;MINOR;SequenceReader should close readers when its close method is called #391. Fixes IO-782. Thanks to Matteo Di Giovinazzo, Gary Gregory.;ggregory;;SequenceReader should close readers when its close method is called;Fix wrong implementation;Bug fix;;;;;;;;;;;;;;;;;;;
+18 years;2023;13.05.2023;2.12.;2.12.0;MINOR;Fix symbolic link file filter #450. Fixes IO-790. Thanks to Miguel Muñoz, Gary Gregory.;ggregory;;;Fix wrong implementation;Bug fix;;;;;;;;;;;;;;;;;;;
+18 years;2023;13.05.2023;2.12.;2.12.0;MINOR;Apply nanoseconds precision for QueueInputStream timeout duration. #453. Fixes IO-790. Thanks to maxxedev, Gary Gregory, Bruno P. Kinoshita.;ggregory;;Apply nanoseconds precision for timeout duration;Change implementation;Code redesign;;;;;;;;;;;;;;;;;;;
+18 years;2023;13.05.2023;2.12.;2.12.0;MINOR;-;;;Improve JavaDoc;Improve documentation;Documentation;;;;;;;;;;;;;;;;;;;
+18 years;2023;13.05.2023;2.12.;2.12.0;MINOR;Fix overflow for FileUtilsTest constants #456. Thanks to Marcono1234.;ggregory;;;Fix overflow;Bug fix;;;;;;;;;;;;;;;;;;;
+18 years;2023;13.05.2023;2.12.;2.12.0;MINOR;Serialization is deprecated and will be removed in 3.0. Thanks to Gary Gregory.;ggregory;;Serialization is deprecated and will be removed in 3.0;Change implementation;Code redesign;;;;;;;;;;;;;;;;;;;
+18 years;2023;13.05.2023;2.12.;2.12.0;MINOR;FileSystemUtils.performCommand(String[], int, Duration): Use Locale.getDefault() instead of ENGLISH. Thanks to Gary Gregory.;ggregory;;Use Locale.getDefault() instead of ENGLISH;Change implementation;Code redesign;;;;;;;;;;;;;;;;;;;
+18 years;2023;13.05.2023;2.12.;2.12.0;MINOR;Add GitHub coverage.yml. Thanks to Gary Gregory.;ggregory;;;GitHub coverage;Support for external development tool;;;;;;;;;;;;;;;;;;;
+18 years;2023;13.05.2023;2.12.;2.12.0;MINOR;Add MemoryMappedFileInputStream #215. Fixes IO-726. Thanks to shollander, Gary Gregory.;ggregory;;;Add class;Add support for a new feature;;;;;;;;;;;;;;;;;;;
+18 years;2023;13.05.2023;2.12.;2.12.0;MINOR;Add BrokenReader.INSTANCE. Thanks to Gary Gregory.;ggregory;;;Add constants/variables;Add support for a new feature;;;;;;;;;;;;;;;;;;;
+18 years;2023;13.05.2023;2.12.;2.12.0;MINOR;Add UncheckedBufferedReader. Thanks to Gary Gregory.;ggregory;;;Add class;Add support for a new feature;;;;;;;;;;;;;;;;;;;
+18 years;2023;13.05.2023;2.12.;2.12.0;MINOR;Add UncheckedFilterReader. Thanks to Gary Gregory.;ggregory;;;Add class;Add support for a new feature;;;;;;;;;;;;;;;;;;;
+18 years;2023;13.05.2023;2.12.;2.12.0;MINOR;Add UncheckedFilterWriter. Thanks to Gary Gregory.;ggregory;;;Add class;Add support for a new feature;;;;;;;;;;;;;;;;;;;
+18 years;2023;13.05.2023;2.12.;2.12.0;MINOR;Add UncheckedFilterInputStream. Thanks to Gary Gregory.;ggregory;;;Add class;Add support for a new feature;;;;;;;;;;;;;;;;;;;
+18 years;2023;13.05.2023;2.12.;2.12.0;MINOR;Add UncheckedFilterOutputStream. Thanks to Gary Gregory.;ggregory;;;Add class;Add support for a new feature;;;;;;;;;;;;;;;;;;;
+18 years;2023;13.05.2023;2.12.;2.12.0;MINOR;Add BrokenInputStream.INSTANCE. Thanks to Gary Gregory.;ggregory;;;Add constants/variables;Add support for a new feature;;;;;;;;;;;;;;;;;;;
+18 years;2023;13.05.2023;2.12.;2.12.0;MINOR;Add ClosedInputStream.INSTANCE and deprecate CLOSED_INPUT_STREAM. Thanks to Gary Gregory.;ggregory;;;Add constants/variables;Add support for a new feature;;;;;;;;;;;;;;;;;;;
+18 years;2023;13.05.2023;2.12.;2.12.0;MINOR;-;;;;Deprecate constant;Deprecate functionality;;;;;;;;;;;;;;;;;;;
+18 years;2023;13.05.2023;2.12.;2.12.0;MINOR;Add ClosedReader.INSTANCE and deprecate CLOSED_READER. Thanks to Gary Gregory.;ggregory;;;Add constants/variables;Add support for a new feature;;;;;;;;;;;;;;;;;;;
+18 years;2023;13.05.2023;2.12.;2.12.0;MINOR;-;;;;Deprecate constant;Deprecate functionality;;;;;;;;;;;;;;;;;;;
+18 years;2023;13.05.2023;2.12.;2.12.0;MINOR;Add BrokenWriter.INSTANCE. Thanks to Gary Gregory.;ggregory;;;Add constants/variables;Add support for a new feature;;;;;;;;;;;;;;;;;;;
+18 years;2023;13.05.2023;2.12.;2.12.0;MINOR;Add ClosedOutputStream.INSTANCE and deprecate CLOSED_OUTPUT_STREAM. Thanks to Gary Gregory.;ggregory;;;Add constants/variables;Add support for a new feature;;;;;;;;;;;;;;;;;;;
+18 years;2023;13.05.2023;2.12.;2.12.0;MINOR;-;;;;Deprecate constant;Deprecate functionality;;;;;;;;;;;;;;;;;;;
+18 years;2023;13.05.2023;2.12.;2.12.0;MINOR;Add ClosedWriter.INSTANCE and deprecate CLOSED_WRITER. Thanks to Gary Gregory.;ggregory;;;Add constants/variables;Add support for a new feature;;;;;;;;;;;;;;;;;;;
+18 years;2023;13.05.2023;2.12.;2.12.0;MINOR;-;;;;Deprecate constant;Deprecate functionality;;;;;;;;;;;;;;;;;;;
+18 years;2023;13.05.2023;2.12.;2.12.0;MINOR;Add NullOutputStream.INSTANCE and deprecate NULL_OUTPUT_STREAM. Thanks to Gary Gregory.;ggregory;;;Add constants/variables;Add support for a new feature;;;;;;;;;;;;;;;;;;;
+18 years;2023;13.05.2023;2.12.;2.12.0;MINOR;-;;;;Deprecate constant;Deprecate functionality;;;;;;;;;;;;;;;;;;;
+18 years;2023;13.05.2023;2.12.;2.12.0;MINOR;Add NullPrintStream.INSTANCE and deprecate NULL_PRINT_STREAM. Thanks to Gary Gregory.;ggregory;;;Add constants/variables;Add support for a new feature;;;;;;;;;;;;;;;;;;;
+18 years;2023;13.05.2023;2.12.;2.12.0;MINOR;-;;;;Deprecate constant;Deprecate functionality;;;;;;;;;;;;;;;;;;;
+18 years;2023;13.05.2023;2.12.;2.12.0;MINOR;Add NullWriter.INSTANCE and deprecate NULL_WRITER. Thanks to Gary Gregory.;ggregory;;;Add constants/variables;Add support for a new feature;;;;;;;;;;;;;;;;;;;
+18 years;2023;13.05.2023;2.12.;2.12.0;MINOR;-;;;;Deprecate constant;Deprecate functionality;;;;;;;;;;;;;;;;;;;
+18 years;2023;13.05.2023;2.12.;2.12.0;MINOR;Add NullInputStream.INSTANCE. Thanks to Gary Gregory.;ggregory;;;Add constants/variables;Add support for a new feature;;;;;;;;;;;;;;;;;;;
+18 years;2023;13.05.2023;2.12.;2.12.0;MINOR;Add NullReader.INSTANCE. Thanks to Gary Gregory.;ggregory;;;Add constants/variables;Add support for a new feature;;;;;;;;;;;;;;;;;;;
+18 years;2023;13.05.2023;2.12.;2.12.0;MINOR;Add PathUtils.readString(Path, Charset). Thanks to Gary Gregory.;ggregory;;;Add method;Add support for a new feature;;;;;;;;;;;;;;;;;;;
+18 years;2023;13.05.2023;2.12.;2.12.0;MINOR;Add FileUtils.newOutputStream(File, boolean). Thanks to Gary Gregory.;ggregory;;;Add method;Add support for a new feature;;;;;;;;;;;;;;;;;;;
+18 years;2023;13.05.2023;2.12.;2.12.0;MINOR;Add PathUtils.newOutputStream(Path, boolean). Thanks to Gary Gregory.;ggregory;;;Add method;Add support for a new feature;;;;;;;;;;;;;;;;;;;
+18 years;2023;13.05.2023;2.12.;2.12.0;MINOR;Add UncheckedAppendable. Thanks to Gary Gregory.;ggregory;;;Add class;Add support for a new feature;;;;;;;;;;;;;;;;;;;
+18 years;2023;13.05.2023;2.12.;2.12.0;MINOR;Add and reuse UncheckedIOExceptions. Thanks to Gary Gregory.;ggregory;;;Add class;Add support for a new feature;;;;;;;;;;;;;;;;;;;
+18 years;2023;13.05.2023;2.12.;2.12.0;MINOR;Add PathUtils.getTempDirectory(). Thanks to Gary Gregory.;ggregory;;;Add method;Add support for a new feature;;;;;;;;;;;;;;;;;;;
+18 years;2023;13.05.2023;2.12.;2.12.0;MINOR;Add FileSystem.getNameSeparator(). Thanks to Gary Gregory.;ggregory;;;Add method;Add support for a new feature;;;;;;;;;;;;;;;;;;;
