Year1;Year;Date; ;Version;RELEASE;Changes;By; ;Type;General;General Category;;;;;;;;;;;;;;;;;;;
+11 years;2016;22.04.2016;2,5;2.5.0;MINOR;Support for symlinks with missing target. Added support for JDK7 symlink features when present. Fixes IO-452. Thanks to David Standish.;krosenvold;;Adapt to older Java version ;Fix returning wrong output;Bug fix;;;;;;;;;;;;;;;;;;;
+11 years;2016;22.04.2016;2,5;2.5.0;MINOR;Added testcase to show this was fixed with IO-423. Fixes IO-466.;krosenvold;;;Increase test coverage;Quality assurance;;;;;;;;;;;;;;;;;;;
+11 years;2016;22.04.2016;2,5;2.5.0;MINOR;Correct exception message in FileUtils.getFile(File, String...). Fixes IO-479. Thanks to Zhouce Chen.;sebb;;Fix exception message;Fix conformance to specification;Bug fix;;;;;;;;;;;;;;;;;;;
+11 years;2016;22.04.2016;2,5;2.5.0;MINOR;Introduce new class AppendableOutputStream. Fixes IO-406. Thanks to Niall Pemberton.;britter;;;Add class;Add support for a new feature;;;;;;;;;;;;;;;;;;;
+11 years;2016;22.04.2016;2,5;2.5.0;MINOR;Update to JUnit 4.12. Fixes IO-465. Thanks to based2.;britter;;Update to JUnit 4.12;Add functionality;Add support for a new feature;;;;;;;;;;;;;;;;;;;
+11 years;2016;22.04.2016;2,5;2.5.0;MINOR;IOExceptionWithCause no longer needed. Fixes IO-462.;sebb;;Adapt to newer Java version ;Deprecate class;Deprecate functionality;;;;;;;;;;;;;;;;;;;
+11 years;2016;22.04.2016;2,5;2.5.0;MINOR;Add WindowsLineEndingInputStream and UnixLineEndingInputStream. Fixes IO-459. Thanks to Kristian Rosenvold.;olamy;;;Add class;Add support for a new feature;;;;;;;;;;;;;;;;;;;
+11 years;2016;22.04.2016;2,5;2.5.0;MINOR;Add a BoundedReader, a wrapper that can be used to constrain access to an underlying stream when used with mark/reset - to avoid overflowing the mark limit of the underlying buffer. Fixes IO-457. Thanks to Kristian Rosenvold.;olamy;;;Add class;Add support for a new feature;;;;;;;;;;;;;;;;;;;
+11 years;2016;22.04.2016;2,5;2.5.0;MINOR;Regression in FileUtils.readFileToString from 2.0.1. Fixes IO-453. Thanks to Steven Christou.;sebb;;;Fix regression;Bug fix;;;;;;;;;;;;;;;;;;;
+11 years;2016;22.04.2016;2,5;2.5.0;MINOR;ant test fails - resources missing from test classpath. Fixes IO-451. Thanks to David Standish.;sebb;;Fix failing test;Fix failing build;Bug fix;;;;;;;;;;;;;;;;;;;
+11 years;2016;22.04.2016;2,5;2.5.0;MINOR;Document that FileUtils.deleteDirectory, directoryContains and cleanDirectory may throw an IllegalArgumentException in case the passed directory does not exist or is not a directory. Fixes IO-435. Thanks to Dominik Stadler.;tn;;Javadoc of methods in FileUtils does not mention thrown IllegalArgumentException;Fix documentation;Documentation;;;;;;;;;;;;;;;;;;;
+11 years;2016;22.04.2016;2,5;2.5.0;MINOR;Add API IOUtils.closeQuietly(Closeable...). Fixes IO-426.;ggregory;;;Add method;Add support for a new feature;;;;;;;;;;;;;;;;;;;
+11 years;2016;22.04.2016;2,5;2.5.0;MINOR;Javadoc fixes, mostly to appease 1.8.0. Fixes IO-424. Thanks to Ville Skyttä.;ggregory;;;Fix documentation;Documentation;;;;;;;;;;;;;;;;;;;
+11 years;2016;22.04.2016;2,5;2.5.0;MINOR;Deprecate Charsets Charset constants in favor of Java 7's java.nio.charset.StandardCharsets. Fixes IO-422.;ggregory;;NIO;Deprecate constant;Deprecate functionality;;;;;;;;;;;;;;;;;;;
+11 years;2016;22.04.2016;2,5;2.5.0;MINOR;Readfully() That Returns A Byte Array. Fixes IO-410. Thanks to Beluga Behr.;sebb;;;Add method;Add support for a new feature;;;;;;;;;;;;;;;;;;;
+11 years;2016;22.04.2016;2,5;2.5.0;MINOR;Overload IOUtils buffer methods to accept buffer size. Fixes IO-395. Thanks to Beluga Behr.;brentworden;;Overload IOUtils buffer methods to accept buffer size;Add method;Add support for a new feature;;;;;;;;;;;;;;;;;;;
+11 years;2016;22.04.2016;2,5;2.5.0;MINOR;FileUtils.sizeOfDirectory can throw IllegalArgumentException. Fixes IO-389. Thanks to Austin Doupnik.;sebb;;FileUtils.sizeOfDirectory can throw IllegalArgumentException;Fix concurrency;Bug fix;;;;;;;;;;;;;;;;;;;
+11 years;2016;22.04.2016;2,5;2.5.0;MINOR;FileUtils.sizeOfDirectoryAsBigInteger can overflow. Ensure that recursive calls all use BigInteger. Fixes IO-390.;sebb;;;Fix overflow;Bug fix;;;;;;;;;;;;;;;;;;;
+11 years;2016;22.04.2016;2,5;2.5.0;MINOR;Chunked IO for large arrays. Added writeChunked(byte[], OutputStream) and writeChunked(char[] Writer) Added ChunkedOutputStream, ChunkedWriter. Fixes IO-382.;sebb;;Add classes;Reduce memory consumption;Memory improvement;;;;;;;;;;;;;;;;;;;
+11 years;2016;22.04.2016;2,5;2.5.0;MINOR;FileUtils.doCopyFile can potentially loop forever Exit loop if no data to copy. Fixes IO-385.;sebb;;;Fix infinite loop;Bug fix;;;;;;;;;;;;;;;;;;;
+11 years;2016;22.04.2016;2,5;2.5.0;MINOR;"FileUtils.doCopyFile caches the file size; needs to be documented Added Javadoc; show file lengths in exception message. Fixes IO-383.";sebb;;;Fix documentation;Documentation;;;;;;;;;;;;;;;;;;;
+11 years;2016;22.04.2016;2,5;2.5.0;MINOR;Convert IOCase to a Java 1.5+ Enumeration [N.B. this is binary compatible]. Fixes IO-239.;sebb;;Adapt to newer Java version ;Change implementation;Code redesign;;;;;;;;;;;;;;;;;;;
+11 years;2016;22.04.2016;2,5;2.5.0;MINOR;Add Methods for Buffering Streams/Writers To IOUtils Added overloaded buffer() methods - see also IO-330. Fixes IO-233.;sebb;;;Add method;Add support for a new feature;;;;;;;;;;;;;;;;;;;
+11 years;2016;22.04.2016;2,5;2.5.0;MINOR;IOUtils#toBufferedOutputStream/toBufferedWriter to conditionally wrap the output Added overloaded buffer() methods - see also IO-233. Fixes IO-330.;sebb;;;Add method;Add support for a new feature;;;;;;;;;;;;;;;;;;;
+11 years;2016;22.04.2016;2,5;2.5.0;MINOR;Add FileUtils.copyInputStreamToFile API with option to leave the source open. See copyInputStreamToFile(final InputStream source, final File destination, boolean closeSource). Fixes IO-381.;ggregory;;;Add method;Add support for a new feature;;;;;;;;;;;;;;;;;;;
+11 years;2016;22.04.2016;2,5;2.5.0;MINOR;FileUtils.copyInputStreamToFile should document it closes the input source. Fixes IO-380. Thanks to claudio_ch.;sebb;;;Fix documentation;Documentation;;;;;;;;;;;;;;;;;;;
+11 years;2016;22.04.2016;2,5;2.5.0;MINOR;Tailer erroneously considers file as new. Fix to use file.lastModified() rather than System.currentTimeMillis(). Fixes IO-279.;sebb;;use file.lastModified() rather than System.currentTimeMillis();Fix wrong implementation;Bug fix;;;;;;;;;;;;;;;;;;;
+11 years;2016;22.04.2016;2,5;2.5.0;MINOR;"CharSequenceInputStream#reset() behaves incorrectly in case when buffer size is not dividable by data size. Fix code so skip relates to the encoded bytes; reset now re-encodes the data up to the point of the mark. Fixes IO-356.";sebb;;"Fix code so skip relates to the encoded bytes; reset now re-encodes the data up to the point of the mark";Fix wrong implementation;Bug fix;;;;;;;;;;;;;;;;;;;
+11 years;2016;22.04.2016;2,5;2.5.0;MINOR;CharSequenceInputStream - add tests for available() Fix code so it really does reflect a minimum available. Fixes IO-379.;sebb;;;Increase test coverage;Quality assurance;;;;;;;;;;;;;;;;;;;
+11 years;2016;22.04.2016;2,5;2.5.0;MINOR;"getPrefixLength returns null if filename has leading slashes Javadoc: add examples to show correct behavior; add unit tests. Fixes IO-328.";sebb;;Fix ambiguous JavaDoc;Fix documentation;Documentation;;;;;;;;;;;;;;;;;;;
+11 years;2016;22.04.2016;2,5;2.5.0;MINOR;FileUtils.listFilesAndDirs includes original dir in results even when it doesn't match filter Javadoc: clarify that original dir is included in the results. Fixes IO-299.;sebb;;;Fix documentation;Documentation;;;;;;;;;;;;;;;;;;;
+11 years;2016;22.04.2016;2,5;2.5.0;MINOR;Add ByteArrayOutputStream.toInputStream(). Fixes IO-346.;sebb;;;Add method;Add support for a new feature;;;;;;;;;;;;;;;;;;;
+11 years;2016;22.04.2016;2,5;2.5.0;MINOR;ClassLoaderObjectInputStream does not handle primitive typed members. Fixes IO-368.;sebb;;Handle correctly primitve types;Fix wrong implementation;Bug fix;;;;;;;;;;;;;;;;;;;
+11 years;2016;22.04.2016;2,5;2.5.0;MINOR;A constant for holding the BOM character (U+FEFF). Fixes IO-341.;sebb;;A constant for holding the BOM character (U+FEFF);Add constants/variables;Add support for a new feature;;;;;;;;;;;;;;;;;;;
+11 years;2016;22.04.2016;2,5;2.5.0;MINOR;Deprecate all methods that use the default encoding. Fixes IO-314.;sebb;;Deprecate all methods that use the default encoding;Deprecate method;Deprecate functionality;;;;;;;;;;;;;;;;;;;
+11 years;2016;22.04.2016;2,5;2.5.0;MINOR;When a file is rotated, finish reading previous file prior to starting new one. Fixes IO-338.;sebb;;;Fix wrong implementation;Bug fix;;;;;;;;;;;;;;;;;;;
+11 years;2016;22.04.2016;2,5;2.5.0;MINOR;Commons IO Tailer does not respect UTF-8 Charset. Fixes IO-354.;sebb;;Commons IO Tailer does not respect UTF-8 Charset;Fix wrong implementation;Bug fix;;;;;;;;;;;;;;;;;;;
+11 years;2016;22.04.2016;2,5;2.5.0;MINOR;What should happen in FileUtils.sizeOf[Directory] when an overflow takes place? Added Javadoc. Fixes IO-323.;sebb;;;Add documentation;Documentation;;;;;;;;;;;;;;;;;;;
+11 years;2016;22.04.2016;2,5;2.5.0;MINOR;FileUtils.moveDirectory can produce misleading error message on failure. Fixes IO-372.;sebb;;Improve exception message ;Code refactoring;Maintainability improvement;;;;;;;;;;;;;;;;;;;
+11 years;2016;22.04.2016;2,5;2.5.0;MINOR;FilenameUtils.splitOnTokens(String text) check for '**' could be simplified. Fixes IO-375.;sebb;;Use caching to simplify check;Code simplification;Maintainability improvement;;;;;;;;;;;;;;;;;;;
+11 years;2016;22.04.2016;2,5;2.5.0;MINOR;WildcardFileFilter ctors should not use null to mean IOCase.SENSITIVE when delegating to other ctors. Fixes IO-374.;sebb;;;Fix wrong implementation;Bug fix;;;;;;;;;;;;;;;;;;;
+11 years;2016;22.04.2016;2,5;2.5.0;MINOR;IOUtils.contentEquals* methods returns false if input1 == input2, should return true. Fixes IO-362. Thanks to mmadson, ggregory.;ggregory;;;Fix returning wrong output;Bug fix;;;;;;;;;;;;;;;;;;;
+11 years;2016;22.04.2016;2,5;2.5.0;MINOR;Add API FileUtils.forceMkdirsParent(). Fixes IO-361.;ggregory;;;Add method;Add support for a new feature;;;;;;;;;;;;;;;;;;;
+11 years;2016;22.04.2016;2,5;2.5.0;MINOR;Add API Charsets.requiredCharsets(). Fixes IO-360.;ggregory;;;Add method;Add support for a new feature;;;;;;;;;;;;;;;;;;;
+11 years;2016;22.04.2016;2,5;2.5.0;MINOR;Add IOUtils.skip and skipFully(ReadableByteChannel, long). Fixes IO-359. Thanks to yukoba.;ggregory;;;Add method;Add support for a new feature;;;;;;;;;;;;;;;;;;;
+11 years;2016;22.04.2016;2,5;2.5.0;MINOR;Add IOUtils.read and readFully(ReadableByteChannel, ByteBuffer buffer). Fixes IO-358. Thanks to yukoba.;ggregory;;;Add method;Add support for a new feature;;;;;;;;;;;;;;;;;;;
+11 years;2016;22.04.2016;2,5;2.5.0;MINOR;[Tailer] InterruptedException while the thread is sleeping is silently ignored. Fixes IO-357. Thanks to mortenh.;ggregory;;Tailer silently ignores interruptions while sleeping;Fix wrong implementation;Bug fix;;;;;;;;;;;;;;;;;;;
+11 years;2016;22.04.2016;2,5;2.5.0;MINOR;Add API IOUtils.copy(InputStream, OutputStream, int). Fixes IO-353. Thanks to ggregory.;ggregory;;;Add method;Add support for a new feature;;;;;;;;;;;;;;;;;;;
+11 years;2016;22.04.2016;2,5;2.5.0;MINOR;Add API with array offset and length argument to FileUtils.writeByteArrayToFile. Fixes IO-349. Thanks to scop.;ggregory;;methods that take an offset and length should be added, inline with the byte array-oriented methods in the Java standard library;Add method;Add support for a new feature;;;;;;;;;;;;;;;;;;;
+11 years;2016;22.04.2016;2,5;2.5.0;MINOR;Spelling fixes. Fixes IO-352. Thanks to scop.;ggregory;;Fix spelling;Stylistic improvement;Maintainability improvement;;;;;;;;;;;;;;;;;;;
+11 years;2016;22.04.2016;2,5;2.5.0;MINOR;Missing information in IllegalArgumentException thrown by org.apache.commons.io.FileUtils#validateListFilesParameters. Fixes IO-348. Thanks to plcstpierre.;ggregory;;Improve exception message ;Code refactoring;Maintainability improvement;;;;;;;;;;;;;;;;;;;
+11 years;2016;22.04.2016;2,5;2.5.0;MINOR;Supply a hook method allowing Tailer actively determining stop condition. Fixes IO-345. Thanks to mkresse.;ggregory;;;Add method;Add support for a new feature;;;;;;;;;;;;;;;;;;;
+11 years;2016;22.04.2016;2,5;2.5.0;MINOR;Improper Javadoc comment for FilenameUtils.indexOfExtension. Fixes IO-436. Thanks to christoph.schneegans.;ggregory;;;Fix documentation;Documentation;;;;;;;;;;;;;;;;;;;
+11 years;2016;22.04.2016;2,5;2.5.0;MINOR;Make IOUtils.EOF public and reuse it in various classes. Fixes IO-437.;ggregory;;Make constant public and reuse it;Change access modifier;Code redesign;;;;;;;;;;;;;;;;;;;
+7 years;2012;12.06.2012;2,4;2.4.0;MINOR;;;;;;;;;;;;;;;;;;;;;;;;;
+7 years;2012;12.06.2012;2,4;2.4.0;MINOR;org.apache.commons.io.comparator Javadoc is inconsistent with real code. Fixes IO-343. Thanks to igorlash.;ggregory;;Javadoc is inconsistent with real code;Fix documentation;Documentation;;;;;;;;;;;;;;;;;;;
+7 years;2012;12.06.2012;2,4;2.4.0;MINOR;Yottabyte (YB) incorrectly defined in FileUtils. Fixes IO-336. Thanks to rleavelle.;ggregory;;Yottabyte (YB) incorrectly defined in FileUtils;Fix declaration;Bug fix;;;;;;;;;;;;;;;;;;;
+7 years;2012;12.06.2012;2,4;2.4.0;MINOR;Tailer locks file from deletion/rename on Windows. Fixes IO-269. Thanks to sebb.;ggregory;;;Fix wrong implementation;Bug fix;;;;;;;;;;;;;;;;;;;
+7 years;2012;12.06.2012;2,4;2.4.0;MINOR;Tailer erroneously considers file as new. Fixes IO-279. Thanks to Sergio Bossa, Chris Baron.;sebb;;Tailer erroneously considers file as new;Fix wrong implementation;Bug fix;;;;;;;;;;;;;;;;;;;
+7 years;2012;12.06.2012;2,4;2.4.0;MINOR;Tailer#readLines - incorrect CR handling. Fixes IO-335.;sebb;;incorrect CR handling;Fix wrong implementation;Bug fix;;;;;;;;;;;;;;;;;;;
+7 years;2012;12.06.2012;2,4;2.4.0;MINOR;"FileUtils.toURLs throws NPE for null parameter; document the behavior. Fixes IO-334.";sebb;;"FileUtils.toURLs throws NPE for null parameter; document the behavior";Fix documentation;Documentation;;;;;;;;;;;;;;;;;;;
+7 years;2012;12.06.2012;2,4;2.4.0;MINOR;Export OSGi packages at version 1.x in addition to 2.x. Fixes IO-333. Thanks to fmeschbe.;ggregory;;Export OSGi packages at version 1.x in addition to 2.x;Change implementation;Code redesign;;;;;;;;;;;;;;;;;;;
+7 years;2012;12.06.2012;2,4;2.4.0;MINOR;Add XmlStreamReader support for UTF-32. Fixes IO-320. Thanks to ggregory.;ggregory;;Add XmlStreamReader support for UTF-32;Add functionality;Add support for a new feature;;;;;;;;;;;;;;;;;;;
+7 years;2012;12.06.2012;2,4;2.4.0;MINOR;BOMInputStream wrongly detects UTF-32LE_BOM files as UTF-16LE_BOM files in method getBOM(). Fixes IO-331. Thanks to ggregory.;ggregory;;BOMInputStream wrongly detects UTF-32LE_BOM files as UTF-16LE_BOM files in method getBOM();Fix wrong implementation;Bug fix;;;;;;;;;;;;;;;;;;;
+7 years;2012;12.06.2012;2,4;2.4.0;MINOR;Improve tailer's reading performance. Fixes IO-332. Thanks to liangly.;ggregory;;Use large buffer to avoid accessing the underlying system;Code refinement;Performance improvement;;;;;;;;;;;;;;;;;;;
+7 years;2012;12.06.2012;2,4;2.4.0;MINOR;Improve Tailer performance with buffered reads (see IO-332). Fixes IO-279.;ggregory;;Use large buffer to avoid accessing the underlying system;Code refinement;Performance improvement;;;;;;;;;;;;;;;;;;;
+7 years;2012;12.06.2012;2,4;2.4.0;MINOR;FileUtils.writeLines uses unbuffered IO. Fixes IO-329. Thanks to tivv.;ggregory;;Use large buffer to avoid accessing the underlying system;Code refinement;Performance improvement;;;;;;;;;;;;;;;;;;;
+7 years;2012;12.06.2012;2,4;2.4.0;MINOR;Add byteCountToDisplaySize(BigInteger). Fixes IO-327. Thanks to ggregory.;ggregory;;;Add method;Add support for a new feature;;;;;;;;;;;;;;;;;;;
+7 years;2012;12.06.2012;2,4;2.4.0;MINOR;Add new FileUtils.sizeOf[Directory] APIs to return BigInteger. Fixes IO-326. Thanks to ggregory, kinow.;ggregory;;;Add method;Add support for a new feature;;;;;;;;;;;;;;;;;;;
+7 years;2012;12.06.2012;2,4;2.4.0;MINOR;Add IOUtils.toByteArray methods to work with URL and URI. Fixes IO-325. Thanks to raviprak.;ggregory;;To work with URL and URI;Add method;Add support for a new feature;;;;;;;;;;;;;;;;;;;
+7 years;2012;12.06.2012;2,4;2.4.0;MINOR;Add missing Charset sister APIs to method that take a String charset name. Fixes IO-324. Thanks to raviprak.;ggregory;;Method that take a String charset name;Add method;Add support for a new feature;;;;;;;;;;;;;;;;;;;
+7 years;2012;12.06.2012;2,4;2.4.0;MINOR;FileUtils.sizeOfDirectory follows symbolic links. Fixes IO-319. Thanks to raviprak.;ggregory;;IllegalArgumentException;Handle exception;Bug fix;;;;;;;;;;;;;;;;;;;
+7 years;2012;10.04.2012;2,3;2.3.0;MINOR;;;;;;;;;;;;;;;;;;;;;;;;;
+7 years;2012;10.04.2012;2,3;2.3.0;MINOR;Add and use class Charsets. Fixes IO-322. Thanks to ggregory.;ggregory;;;Add class;Add support for a new feature;;;;;;;;;;;;;;;;;;;
+7 years;2012;10.04.2012;2,3;2.3.0;MINOR;ByteOrderMark UTF_32LE is incorrect. Fixes IO-321. Thanks to ggregory.;ggregory;;;Fix declaration;Bug fix;;;;;;;;;;;;;;;;;;;
+7 years;2012;10.04.2012;2,3;2.3.0;MINOR;Add Charset sister APIs to method that take a String charset name. Fixes IO-318. Thanks to ggregory.;;;Add Charset sister APIs to method that take a String charset name;Add method;Add support for a new feature;;;;;;;;;;;;;;;;;;;
+7 years;2012;26.03.2012;2,2;2.2.0;MINOR;;;;;;;;;;;;;;;;;;;;;;;;;
+7 years;2012;26.03.2012;2,2;2.2.0;MINOR;Add IOUtils.toBufferedReader(Reader). Fixes IO-313. Thanks to ggregory.;ggregory;;;Add method;Add support for a new feature;;;;;;;;;;;;;;;;;;;
+7 years;2012;26.03.2012;2,2;2.2.0;MINOR;Allow applications to provide buffer (or size) for copyLarge methods. Fixes IO-308. Thanks to Manoj Mokashi.;sebb;;Allow applications to provide buffer (or size) for copyLarge methods;Add functionality;Add support for a new feature;;;;;;;;;;;;;;;;;;;
+7 years;2012;26.03.2012;2,2;2.2.0;MINOR;IOUtils.read(InputStream/Reader) ignores the offset parameter. Fixes IO-311. Thanks to Robert Muir.;sebb;;Method ignores the offset parameter;Fix wrong implementation;Bug fix;;;;;;;;;;;;;;;;;;;
+7 years;2012;26.03.2012;2,2;2.2.0;MINOR;CharSequenceInputStream(CharSequence s, Charset charset, int bufferSize) ignores bufferSize. Fixes IO-312.;sebb;;Method ignores bufferSize;Fix wrong implementation;Bug fix;;;;;;;;;;;;;;;;;;;
+7 years;2012;26.03.2012;2,2;2.2.0;MINOR;New copyLarge() method in IOUtils that takes additional offset, length arguments. Fixes IO-305. Thanks to Manoj Mokashi.;sebb;;Method that takes additional offset, length arguments;Add method;Add support for a new feature;;;;;;;;;;;;;;;;;;;
+7 years;2012;26.03.2012;2,2;2.2.0;MINOR;FileUtils.moveDirectoryToDirectory removes source directory if destination is a sub-directory. Fixes IO-300.;sebb;;Method removes source directory if destination is a sub-directory.;Fix wrong implementation;Bug fix;;;;;;;;;;;;;;;;;;;
+7 years;2012;26.03.2012;2,2;2.2.0;MINOR;ReaderInputStream#read(byte[] b, int off, int len) should check for valid parameters. Fixes IO-307.;sebb;;Add parameter validation ;Fix wrong implementation;Bug fix;;;;;;;;;;;;;;;;;;;
+7 years;2012;26.03.2012;2,2;2.2.0;MINOR;Use terabyte (TB), petabyte (PB) and exabyte (EB) in FileUtils.byteCountToDisplaySize(long size). Fixes IO-287. Thanks to Ron Kuris, Gary Gregory.;bayard;;Use terabyte (TB), petabyte (PB) and exabyte (EB);Add functionality;Add support for a new feature;;;;;;;;;;;;;;;;;;;
+7 years;2012;26.03.2012;2,2;2.2.0;MINOR;ReaderInputStream#read(byte[] b, int off, int len) should always return 0 for length == 0. Fixes IO-306.;sebb;;;Fix conformance to specification;Bug fix;;;;;;;;;;;;;;;;;;;
+7 years;2012;26.03.2012;2,2;2.2.0;MINOR;FileUtils.listFiles() doesn't return directories. Fixes IO-173. Thanks to Marcos Vinícius da Silva.;sebb;;;Add functionality;Add support for a new feature;;;;;;;;;;;;;;;;;;;
+7 years;2012;26.03.2012;2,2;2.2.0;MINOR;"""FileUtils#deleteDirectoryOnExit(File)"" does not work. Fixes IO-276. Thanks to nkami.";sebb;;Switch methods calling oderd;Fix wrong implementation;Bug fix;;;;;;;;;;;;;;;;;;;
+7 years;2012;26.03.2012;2,2;2.2.0;MINOR;BoundedInputStream.read() treats max differently from BoundedInputStream.read(byte[]...). Fixes IO-273. Thanks to sebb.;sebb;;;Fix inconsistency;Bug fix;;;;;;;;;;;;;;;;;;;
+7 years;2012;26.03.2012;2,2;2.2.0;MINOR;CharSequenceInputStream to efficiently stream content of a CharSequence. Fixes IO-297. Thanks to Oleg Kalnichevski.;sebb;;;Add class;Add support for a new feature;;;;;;;;;;;;;;;;;;;
+7 years;2012;26.03.2012;2,2;2.2.0;MINOR;ReaderInputStream optimization: more efficient reading of small chunks of data. Fixes IO-296. Thanks to Oleg Kalnichevski.;sebb;;;Avoid unnecessary allocation;Memory improvement;;;;;;;;;;;;;;;;;;;
+7 years;2012;26.03.2012;2,2;2.2.0;MINOR;Various methods of class 'org.apache.commons.io.FileUtils' incorrectly suppress 'java.io.IOException'. Fixes IO-298. Thanks to Christian Schulte.;sebb;;Various methods of class 'org.apache.commons.io.FileUtils' incorrectly suppress 'java.io.IOException';Fix wrong implementation;Bug fix;;;;;;;;;;;;;;;;;;;
+7 years;2012;26.03.2012;2,2;2.2.0;MINOR;The second constructor of Tailer class does not pass 'delay' to the third one. Fixes IO-304. Thanks to liangly.;ggregory;;The second constructor of Tailer class does not pass 'delay' to the third one;Fix wrong implementation;Bug fix;;;;;;;;;;;;;;;;;;;
+7 years;2012;26.03.2012;2,2;2.2.0;MINOR;TeeOutputStream does not call branch.close() when main.close() throws an exception. Fixes IO-303. Thanks to fabian.barney.;ggregory;;;Fix wrong implementation;Bug fix;;;;;;;;;;;;;;;;;;;
+7 years;2012;26.03.2012;2,2;2.2.0;MINOR;ArrayIndexOutOfBoundsException in BOMInputStream when reading a file without BOM multiple times. Fixes IO-302. Thanks to jsteuerwald, detinho.;ggregory;;ArrayIndexOutOfBoundsException;Handle Exception;Bug fix;;;;;;;;;;;;;;;;;;;
+7 years;2012;26.03.2012;2,2;2.2.0;MINOR;Add IOUtils.closeQuietly(Selector) necessary. Fixes IO-301. Thanks to kaykay.unique.;ggregory;;;Add method;Add support for a new feature;;;;;;;;;;;;;;;;;;;
+7 years;2012;26.03.2012;2,2;2.2.0;MINOR;IOUtils.closeQuietly() should take a ServerSocket as a parameter. Fixes IO-292. Thanks to sebb.;sebb;;extend Socket;Change implementation;Code redesign;;;;;;;;;;;;;;;;;;;
+7 years;2012;26.03.2012;2,2;2.2.0;MINOR;Add read/readFully methods to IOUtils. Fixes IO-290. Thanks to sebb.;sebb;;;Add method;Add support for a new feature;;;;;;;;;;;;;;;;;;;
+7 years;2012;26.03.2012;2,2;2.2.0;MINOR;Supply a ReversedLinesFileReader. Fixes IO-288. Thanks to Georg Henzler.;sebb;;;Add class;Add support for a new feature;;;;;;;;;;;;;;;;;;;
+7 years;2012;26.03.2012;2,2;2.2.0;MINOR;Add new function FileUtils.directoryContains. Fixes IO-291. Thanks to ggregory.;ggregory;;;Add method;Add support for a new feature;;;;;;;;;;;;;;;;;;;
+7 years;2012;26.03.2012;2,2;2.2.0;MINOR;"FileUtils.contentEquals and IOUtils.contentEquals - Add option to ignore ""line endings"" Added contentEqualsIgnoreEOL methods to both classes. Fixes IO-275. Thanks to CJ Aspromgos.";sebb;;"Add option to ignore ""line endings""";Add functionality;Add support for a new feature;;;;;;;;;;;;;;;;;;;
+6 years;2011;28.09.2011;2,1;2.1.0;MINOR;;;;;;;;;;;;;;;;;;;;;;;;;
+6 years;2011;28.09.2011;2,1;2.1.0;MINOR;Use standard Maven directory layout. Fixes IO-285. Thanks to ggregory.;ggregory;;Use standard Maven directory layout.;Change implementation;Code redesign;;;;;;;;;;;;;;;;;;;
+6 years;2011;28.09.2011;2,1;2.1.0;MINOR;Add IOUtils API toString for URL and URI to get contents. Fixes IO-284. Thanks to ggregory.;ggregory;;;Add method;Add support for a new feature;;;;;;;;;;;;;;;;;;;
+6 years;2011;28.09.2011;2,1;2.1.0;MINOR;Add API FileUtils.copyFile(File input, OutputStream output). Fixes IO-282. Thanks to ggregory.;ggregory;;;Add method;Add support for a new feature;;;;;;;;;;;;;;;;;;;
+6 years;2011;28.09.2011;2,1;2.1.0;MINOR;Dubious use of mkdirs() return code. Fixes IO-280. Thanks to sebb.;sebb;;;Fix wrong implementation;Bug fix;;;;;;;;;;;;;;;;;;;
+6 years;2011;28.09.2011;2,1;2.1.0;MINOR;ReaderInputStream enters infinite loop when it encounters an unmappable character. Fixes IO-277.;;;;Fix infinite loop;Bug fix;;;;;;;;;;;;;;;;;;;
+6 years;2011;28.09.2011;2,1;2.1.0;MINOR;FileUtils.moveFile() Javadoc should specify FileExistsException thrown. Fixes IO-264.;;;JavaDoc should specify FileExistsException thrown;Fix documentation;Documentation;;;;;;;;;;;;;;;;;;;
+6 years;2011;28.09.2011;2,1;2.1.0;MINOR;FileAlterationObserver has no getter for FileFilter. Fixes IO-262.;;;getter;Add method;Add support for a new feature;;;;;;;;;;;;;;;;;;;
+6 years;2011;28.09.2011;2,1;2.1.0;MINOR;Add FileUtils.getFile API with varargs parameter. Fixes IO-261.;;;getFile API with varargs parameter;Add method;Add support for a new feature;;;;;;;;;;;;;;;;;;;
+6 years;2011;28.09.2011;2,1;2.1.0;MINOR;ClassLoaderObjectInputStream does not handle Proxy classes. Fixes IO-260.;;;Overload methods to correct behavior;Fix wrong implementation;Bug fix;;;;;;;;;;;;;;;;;;;
+6 years;2011;28.09.2011;2,1;2.1.0;MINOR;FileAlterationMonitor.stop(boolean allowIntervalToFinish). Fixes IO-259.;;;;Add method;Add support for a new feature;;;;;;;;;;;;;;;;;;;
+6 years;2011;28.09.2011;2,1;2.1.0;MINOR;Add new APPEND parameter for writing string into files. Fixes IO-182.;;;Add new APPEND parameter for writing string into files;Add functionality;Add support for a new feature;;;;;;;;;;;;;;;;;;;
+6 years;2011;28.09.2011;2,1;2.1.0;MINOR;Tailer returning partial lines when reaching EOF before EOL. Fixes IO-274. Thanks to Frank Grimes.;sebb;;;Fix wrong implementation;Bug fix;;;;;;;;;;;;;;;;;;;
+6 years;2011;28.09.2011;2,1;2.1.0;MINOR;FileUtils.copyFile() throws IOException when copying large files to a shared directory (on Windows). Fixes IO-266. Thanks to Igor Smereka.;sebb;;IOException;Handle exception;Bug fix;;;;;;;;;;;;;;;;;;;
