Changes,General Category
BUGFIX: Lombok and gradle v4.9 didn't work together; that's been fixed. Issue #1716 and gradle-apt-plugin issue #87,Bug fix
"FEATURE: You can now make builders for type hierarchies, using the new (experimental) @SuperBuilder annotation. Thanks for the contribution, Jan Rieke. @SuperBuilder documentation",Add support for a new feature
"FEATURE: @NoArgsConstructor, including forcing one with lombok.config: lombok.noArgsConstructor.extraPrivate=true now take any defaults set with @Builder.Default into account. Issue #1347",Add support for a new feature
,
BREAKING CHANGE: The in 1.16.22 introduced configuration key lombok.noArgsConstructor.extraPrivate is now false by default. Issue #1708,Bug fix
"BUGFIX: Do not generate a private no-args constructor if that breaks the code. Issue #1703, Issue #1704, Issue #1712",Bug fix
Issue #1704,Bug fix
Issue #1712,Bug fix
BUGFIX: Using boolean parameters in lombok annotations would fail. Issue #1709,Bug fix
BUGFIX: Delombok would give an error message. Issue #1705,Bug fix
BUGFIX: Eclipse java10 var support didn't work if lombok was installed in your eclipse. Issue #1676,Bug fix
FEATURE: Google's Flogger (a.k.a. FluentLogger) is now available via @Flogger. Issue #1697,Add support for a new feature
"FEATURE: @FieldNameConstants has been extended to support prefixes and suffixes. By default, the generated constants are prefixed with FIELD_. Docs on @FieldNameConstants.",Add support for a new feature
,
FEATURE: Private no-args constructor for @Data and @Value to enable deserialization frameworks (like Jackson) to operate out-of-the-box. Use lombok.noArgsConstructor.extraPrivate = false to disable this behavior.,Add support for a new feature
"FEATURE: Methods can now be marked for inclusion in toString, equals, and hashCode generation. There is a new mechanism to mark which fields (and now, methods) are to be included or excluded for the generation of these methods: mark the relevant member with for example @ToString.Include or @EqualsAndHashCode.Exclude. ToString documentation EqualsAndHashCode documentation",Add support for a new feature
FEATURE: @Getter and @Setter also allow onMethod and onParam when put on a type. Issue #1653,Add support for a new feature
FEATURE: @FieldNameConstants is a new feature that generates string constants for your field names. Docs on @FieldNameConstants.,Add support for a new feature
"PLATFORM: Lombok can be compiled on JDK10, and should run on JDK10. Issue #1693",Bug fix
PLATFORM: lombok now counts as an incremental annotation processor for gradle. Should speed up your gradle builds considerably! Issue #1580,Performance improvement
PLATFORM: Fix for using lombok together with JDK9+'s new module-info.java feature. Issue #985,Add support for a new feature
BUGFIX: Solved some issues in eclipse that resulted in error 'A save participant caused problems'. Issue #879,Bug fix
BUGFIX: Netbeans on jdk9. Issue #1617,Bug fix
BUGFIX: Netbeans < 9. Issue #1555,Bug fix
"PROMOTION: var has been promoted from experimental to the main package with no changes. The 'old' experimental one is still around but is deprecated, and is an alias for the new main package one. var documentation.",Code redesign
"OLD-CRUFT: lombok.experimental.Builder and lombok.experimental.Value are deprecated remnants of when these features were still in experimental. They are now removed entirely. If your project is dependent on an older version of lombok which still has those; fret not, lombok still processes these annotations. It just no longer includes them in the jar.",Deprecate functionality
,
"PLATFORM: Better support for jdk9 in the new IntelliJ, Netbeans and for Gradle.",Maintainability improvement
"BREAKING CHANGE: lombok config key lombok.addJavaxGeneratedAnnotation now defaults to false instead of true. Oracle broke this annotation with the release of JDK9, necessitating this breaking change.",Code redesign
"BREAKING CHANGE: lombok config key lombok.anyConstructor.suppressConstructorProperties is now deprecated and defaults to true, that is, by default lombok no longer automatically generates @ConstructorProperties annotations. New config key lombok.anyConstructor.addConstructorProperties now exists; set it to true if you want the old behavior. Oracle more or less broke this annotation with the release of JDK9, necessitating this breaking change.",Deprecate functionality
DEVELOPMENT: Compiling lombok on JDK1.9 is now possible.,Maintainability improvement
"BUGFIX: The generated hashCode would break the contract if callSuper=true,of={}. Issue #1505",Bug fix
BUGFIX: delombok no longer prints the synthetic outer-class parameter. Issue #1521,Bug fix
BUGFIX: @Builder.Default now also works when type parameters are present. Issue #1527,Bug fix
BUGFIX: @Builder now also works on method with a generified return type. Issue #1420,Bug fix
"INSTALLER: By default, the lombok installer now inserts an absolute path in eclipse.ini and friends, instead of a relative path. If you want the old behavior, you can use java -jar -Dlombok.installer.fullpath=false lombok.jar.",Code redesign
,
PLATFORM: JDK9 support much improved since v1.16.16; Issue #985,Maintainability improvement
BUGFIX: Lombok now works with Bazel and Error Prone. Issue #1290,Bug fix
"FEATURE: Lombok has a new website! A few very minor changes to the code to be more consistent with it have been added, mostly to the javadoc.",Documentation
,
FEATURE: @Builder.Default lets you configure default values for your fields when using @Builder. See the Builder feature page for more information. Issue #1201,Add support for a new feature
"PLATFORM: JDK9 now supported for compilation (delomboking with java9 not yet possible). Note, you'll have to do some command line wrangling. See Issue #985",Maintainability improvement
"BUGFIX: The onX feature (which lets you add annotations to generated methods) did not work if the annotation you added contained named parameters, and you are compiling with JDK8's javac. We can't fix this (it's a bug in javac), but we have provided an alternate, prettier way to do onX on javac8+. Issue #778 onX documentation",Bug fix
"BUGFIX: @Data and @Value now respect the configuration for field access when generating equals, hashCode and toString. Issue #1329",Bug fix
BUGFIX: @Builder now marks generated builder 'setters' as @Deprecated if the source field is deprecated. Issue #1342,Bug fix
CHANGE: @ConstructorProperties will now also be generated for private and package private constructors. This is useful for Jackson Issue #1180,Code redesign
,
"FEATURE: Generated classes, methods and fields can now also annotated with @lombok.Generated Issue #1014",Add support for a new feature
"PLATFORM: Lombok can now be used together with other annotation processors that are looking for lombok-generated methods, but only if lombok is the first annotation processor executed. The most commonly used annotation processor affected by this change is MapStruct; we've worked with the mapstruct team specifically to allow any order. Other annotation processors might follow the framework we've built to make this possible; point the authors of any such processor to us and we'll get it sorted MapStruct issue #510 Lombok issue #973",Support for external development tool
PLATFORM: Eclipse: Refactor script 'rename field' when lombok has also generated getters and/or setters for this field is nicer now Issue #210,Maintainability improvement
BUGFIX: Something you never encountered. Issue #1274,Bug fix
"DEPRECATION: The configuration key lombok.addGeneratedAnnotation is now deprecated, use lombok.addJavaxGeneratedAnnotation instead.",Deprecate functionality
,
"FEATURE: var is the mutable sister of val. For now experimental, and opt-in using ALLOW in the flagUsage configuration key. Thanks for the contribution, Bulgakov Alexander.",Add support for a new feature
CHANGE: @Value and @FieldDefaults no longer touch static fields Issue #1254,Code redesign
BUGFIX: val in lambda expressions now work as expected Issue #911,Bug fix
BUGFIX: Getter(lazy=true) now emits an error message when used on a transient field Issue #1236,Bug fix
BUGFIX: Annotation Processors that use ecj internally (dagger) no longer give linkage errors Issue #1218,Bug fix
PLATFORM: Red Hat JBoss Developer Studio is now correctly identified by the installer Issue #1164,Bug fix
BUGFIX: delombok: for-loops with initializers that are not local variables would be generated incorrectly Issue #1076,Bug fix
,
FEATURE: Added support for JBoss logger Issue #1103,Add support for a new feature
ENHANCEMENT: Running javac -Xlint:all would generate a warning about unclaimed annotations Issue #1117,Bug fix
BUGFIX: Eclipse Mars would sometimes throw a NullPointerException when using @Delegate Issue #913,Bug fix
ENHANCEMENT: Add support for older maven-compiler-plugin Issue #1138,Bug fix
,
PLATFORM: Starting jdk9 support: No more error message regarding pid,Add support for a new feature
FEATURE: @Builder updates: It now generates clearFieldName() methods if @Singular is used. Issue #967.,Add support for a new feature
FEATURE: @Builder updates: The annotation can now be put on instance methods. Issue #63.,Add support for a new feature
FEATURE: @Builder updates: @Singular now supports guava's ImmutableTable Issue #937.,Add support for a new feature
"FEATURE: A lombok.config key can now be used to make your fields final and/or private... everywhere. We'll be monitoring the performance impact of this for a while. We'll touch every source file if you turn these on, and even if you don't, we have to call into the lombok config system for every file.",Add support for a new feature
FEATURE: A lombok.config key can now be used to set the default behaviour of @EqualsAndHashCode when generating methods for a class that extends something in regards to calling the superclass implementations of equals and hashCode or not. Issue #965.,Add support for a new feature
FEATURE: Putting @Wither on abstract classes now generates something slightly more useful: An abstract wither method. Issue #945.,Add support for a new feature
BUGFIX: @Helper used to only be be legal in pretty specific places; now it works just about everywhere.,Bug fix
BUGFIX: lambdas with 1 argument that has an explicit type did not pretty print correctly. Issue #972.,Bug fix
"BUGFIX: When using delombok, a source file with only @NonNull annotations on parameters as lombok feature would not get properly delomboked. Issue #950.",Bug fix
BUGFIX: @Delegate in javac would generate arrays instead of varargs parameters. Issue #932.,Bug fix
BUGFIX: @Value and @FieldDefaults no longer make uninitialized static fields final. Issue #928.,Bug fix
ENHANCEMENT: @Builder.ObtainVia now has @Retention(SOURCE) Issue #986.,Add support for a new feature
"ENHANCEMENT: Putting @NonNull on a parameter of an abstract method no longer generates a warning, to allow you to use this annotation to document intended behaviour Issue #807.",Bug fix
,
FEATURE: @Helper can be placed on method-local inner classes to make all methods in the class accessible to the rest of the method. Full documentation.,Add support for a new feature
"FEATURE: @Builder(toBuilder = true) is now available. It produces an instance method that creates a new builder, initialized with all the values of that instance. For more, read the Feature page on Builder.",Add support for a new feature
"FEATURE: the hashCode() method generated by lombok via @EqualsAndHashCode, @Data, and @Value is now smarter about nulls; they are treated as if they hash to a magic prime instead of 0, which reduces hash collisions.",Performance improvement
FEATURE: @NoArgsConstructor(force = true) can be used to create no args constructors even if final fields are present.,Add support for a new feature
BUGFIX: Parameterized static methods with @Builder would produce compiler errors in javac. Issue #828.,Bug fix
BUGFIX: The new annotations-on-types feature introduced in JDK8 did not delombok correctly. Issue #855.,Bug fix
PERFORMANCE: the config system caused significant slowdowns in eclipse if the filesystem is very slow (network file system) or has a slow authentication system.,Performance improvement
BUGFIX: Various quickfixes in Eclipse Mars were broken. Issue #861 Issue #866 Issue #870.,Bug fix
-,Bug fix
-,Bug fix
,
BUGFIX: Lombok now works with Eclipse Mars.,Bug fix
BUGFIX: @UtilityClass could result in uninitialized static variables if compiled with ecj/eclipse. Issue #839,Bug fix
"BUGFIX: This version of lombok has a refactored launcher (the one introduced in v1.16.0), which fixes various bugs related to errors in eclipse concerning loading classes, failure to find lombok classes, and errors on ClassLoaders. Probably impacts issues Issue #767 and Issue #826.",Bug fix
-,Bug fix
,
FEATURE: The config key lombok.extern.findbugs.addSuppressFBWarnings can now be used to add findbugs suppress warnings annotations to all code lombok generates. This addresses feature request Issue #737.,Add support for a new feature
"FEATURE: New lombok annotation: @UtilityClass, for making utility classes (not instantiable, contains only static 'function' methods). See the feature documentation for more information.",Add support for a new feature
BUGFIX: The ant delombok task was broken starting with v1.16.0. Note that the task def class has been changed; taskdef lombok.delombok.ant.Tasks$Delombok instead of the old lombok.delombok.ant.DelombokTask. Issue #810.,Bug fix
BUGFIX: val in javac would occasionally fail if used inside inner classes. This is (probably) fixed. Issue #729 and Issue #616.,Bug fix
-,Bug fix
"BUGFIX: Starting with v1.16.0, lombok would fail to execute as an executable jar if it was in a path with spaces in it. Issue #812.",Bug fix
BUGFIX: v1.16.0 did not work in old eclipse versions (such as eclipse indigo). Issue #818.,Bug fix
,
"BUGFIX: @ExtensionMethod was broken in Eclipse using java 8. Issue #777, Issue #782",Bug fix
"BUGFIX: delombok: Using exotic characters in your source files would overzealously backslash-u escape them. Now, all characters are printed unescaped, assuming your chosen encoding can support them. Otherwise, they are escaped. Issue #794",Bug fix
"PROMOTION: @Builder has graduated from experimental to the main package with a few changes (addition of @Singular, removal of the fluent and chain options). The old one still exists and has been deprecated.",Code redesign
"FEATURE: @Builder now supports adding the @Singular annotation to any field/parameter that represents a collection, which results in a method in the generated builder that takes in one element of that collection and adds it. Lombok takes care of generating the appropriate code to produce a compacted immutable version of the appropriate type. In this version, java.util collections and guava's ImmutableCollections are supported. See the feature documentation for more information.",Add support for a new feature
"FEATURE: Added a launcher to the lombok boot process which removes the need for -Xbootclasspath to be in your eclipse.ini file, and removes all non-public API and third party dependencies (such as ASM) from the lombok jar, thus removing them from your IDE's auto complete offerings in any project that uses lombok. For those debugging lombok, the launcher enables hot code replace which makes debugging a lot easier, as previously one was required to shut down the IDE, rebuild the jar, and relaunch. Add -Dshadow.override.lombok=/path/to/lombok/bin to the launch target for hot code replace.",Add support for a new feature
,
PERFORMANCE: The configuration system typically hit the filesystem twice per read configuration key instead of hardly ever. This is a continuation of Issue #717.,Bug fix
,
BUGFIX: Usage of val would break starting with JDK8 release 1.8.0_20. Issue #766,Bug fix
"BUGFIX: Depending on your eclipse project setup, releases v1.14.0 through v1.14.4 could noticably slow down your eclipse. Issue #717.",Bug fix
,
BUGFIX: GWT produces errors in handlers on line 1 in any source files that use lombok; this has been fixed. Issue #734,Bug fix
BUGFIX-IN-PROGRESS: Many pathfinder issues in eclipse (see the bugfix in progress in v1.14.2) have now been fixed. Issue #717,Bug fix
,
BUGFIX: syntax highlighting in eclipse will become weird and auto-complete may stop working amongst other eclipse features in v1.14.0 (regression from v1.12.6). Issue #723,Bug fix
FEATURE: Added @Tolerate; put this annotation on any method or constructor and lombok will skip it when considering whether or not to generate a method or constructor. This is useful if the types of the parameters of your method do not clash with what lombok would generate.,Add support for a new feature
"FEATURE: Added config key lombok.getter.noIsPrefix, which lets you disable use and generation of isFoo(), instead going with getFoo(), for {@code boolean} fields.",Add support for a new feature
BUGFIX: Errors in the eclipse log with IndexOutOfBound: 2 in ASTConverter.convertType. Issue #721,Bug fix
"BUGFIX-IN-PROGRESS: As yet unknown conditions in eclipse result in lots of IllegalArgumentException in the log with message ""Path must include project and resource name"". Also, 'invalid URL' or 'URI not absolute' errors can occur when using exotic file system abstractions such as Jazz. These bugs haven't been fixed, but instead of catastrophic failure, warning logs will be emitted instead. Issue #717",Bug fix
BUGFIX: mvn builds fail with a 'URI not absolute' exception. Issue #718,Bug fix
,
"FEATURE: You can now configure aspects of lombok project wide (or even workspace wide, or just for a single package) via the configuration system. You can configure many things; run java -jar lombok.jar config -gv for the complete list.",Add support for a new feature
"DEPRECATION: @Delegate has been moved to lombok.experimental.Delegate, and corner cases such as recursive delegation (delegating a type that itself has fields or methods annotated with @Delegate) are now error conditions. See the feature documentation for more information.",Deprecate functionality
"FEATURE: It is now possible to put annotations, such as @Nullable, on the one parameter of generated equals() methods by specifying the onParam= option on @EqualsAndHashCode, similar to how that feature already exists for @Setter. Issue #709",Add support for a new feature
CHANGE: suppressConstructorProperties should now be configured via lombok configuration. Issue #694,Code redesign
"CHANGE: The canEqual method generated by @EqualsAndHashCode, @Value and @Data is now protected instead of public. Issue #695",Code redesign
"BUGFIX: Major work on improving support for JDK8, both for javac and eclipse.",Bug fix
BUGFIX: Deadlocks would occasionally occur in eclipse when using lazy getters Issue #625,Bug fix
BUGFIX: Usage of @SneakyThrows with a javac from JDK8 with -target 1.8 would result in a post compiler error. Issue #690,Bug fix
BUGFIX: Switching workspace on some versions of eclipse resulted in a 'duplicate field' error. Issue #701,Bug fix
,
"BUGFIX: Deadlocks would occasionally occur in eclipse during project builds, especially if using the gradle plugin. Issue #680",Bug fix
PLATFORM: Added support for Eclipse Luna. Issue #644,Support for external development tool
PLATFORM: Initial JDK8 support for eclipse's alpha support in kepler. Issue #632,Add support for a new feature
"FEATURE: The various @Log annotations now support the topic parameter, which sets the logger's name. The default remains the fully qualified type name of the class itself. Issue #667.",Add support for a new feature
BUGFIX: Using lombok with IntelliJ and the IBM JDK would result in NPEs during initialization. Issue #683.,Bug fix
BUGFIX: Eclipse quickfix Surround with try/catch block didn't work inside @SneakyThrows annotated methods Issue #511.,Bug fix
BUGFIX: Eclipse refactoring Extract Local Variable didn't work inside @SneakyThrows annotated methods Issue #668.,Bug fix
BUGFIX: {Netbeans} @SneakyThrows would lead to unused import and break refactorings Issue #544.,Bug fix
BUGFIX: Eclipse Organize Imports would generate error: AST must not be null Issue #666.,Bug fix
BUGFIX: Copying javadoc to getters / setters / withers would copy non-relevant sections too. Issue #620.,Bug fix
"ENHANCEMENT: Lombok used to ship with JNA. It added over 800k to the size of lombok.jar and could mess with usage of JNA in your local environment, especially in eclipse. Issue #682",Performance improvement
DETAIL: {Delombok} Inside enum bodies the delombok formatter didn't respect the emptyLines directive Issue #664.,Bug fix
DETAIL: Use smaller primes (<127) for generating hashcodes Issue #660,Performance improvement
,
BUGFIX: v1.12.2's delombok turns all operator+assignments into just assignment. Fixed. Issue #633,Bug fix
BUGFIX: {Netbeans} v1.12.2 doesn't well with netbeans. Issue #626,Bug fix
ENHANCEMENT: Delombok now supports varied options for how it formats the resulting source files. This includes scanning the source for things like the preferred indent. Use option --format-help for more information. Issue #643,Add support for a new feature
"DETAIL: The primes lombok generates for use in generated hashCode() methods used to be direct copies from Effective Java. It turns out these particular primes are used so much, they tend to be a bit more collision-prone, so we switched them. Now, '277' is used instead of '31'. The primes for booleans have also been changed. Issue #660",Performance improvement
,
"PLATFORM: Initial JDK8 support, without affecting existing support for JDK6 and 7. Issue #524. While lombok will now work on JDK8 / javac8, and netbeans 7.4 and up, lombok does not (yet) support new language features introduced with java8, such as lambda expressions. Support for these features will be added in a future version.",Add support for a new feature
PLATFORM: Running javac on IBM J9 VM would cause NullPointerExceptions when compiling with lombok. These issues should be fixed. Issue #589.,Bug fix
"CHANGE: [JDK8-related] The canonical way to write onMethod / onParameter / onConstructor annotation now uses a double underscore instead of a single underscore, so, now, the proper way to use this feature is @RequiredArgsConstructor(onConstructor=@__(@Inject)). The old way (single underscore) still works, but generates warnings on javac 8.",Code redesign
BUGFIX: Using @NonNull on an abstract method used to cause exceptions during compilation. Issue #594.,Bug fix
BUGFIX: Using @NonNull on methods that also have @SneakyThrows or @Synchronized caused arbitrary behaviour. Issue #623.,Bug fix
"GERMANY: Major version bumped from 0 to 1, because allegedly this is important. Rest assured, this change is nevertheless backwards compatible.",Update dependency
,
"FEATURE: javadoc on fields will now be copied to generated getters / setters / withers. There are ways to specify separate javadoc for the field, the setter, and the getter, and @param and @return are handled appropriately. Addresses feature request Issue #132. @Getter and @Setter documentation. @Wither documentation.",Add support for a new feature
CHANGE: The desugaring of @Getter(lazy=true) is now less object creation intensive. Documentation has been updated to reflect what the new desugaring looks like. @Getter(lazy=true) documentation.,Code redesign
-,Documentation
"PROMOTION: @Value has been promoted from experimental to the main package with no changes. The 'old' experimental one is still around but is deprecated, and is an alias for the new main package one. @Value documentation.",Code redesign
"FEATURE: {Experimental} @Builder support. One of our earliest feature request issues, Issue #89, has finally been addressed. @Builder documentation.",Add support for a new feature
FEATURE: @NonNull on a method or constructor parameter now generates a null-check statement at the start of your method. This nullcheck will throw a NullPointerException with the name of the parameter as the message. Issue #549,Add support for a new feature
BUGFIX: Usage of Lombok.sneakyThrow() or @SneakyThrows would sometimes result in invalid classes (classes which fail with VerifyError). Issue #543,Bug fix
BUGFIX: Using val in try-with-resources did not work for javac. Issue #555,Bug fix
"BUGFIX: When using @Data, warnings are not generated if certain aspects are not generated because you wrote explicit versions of them. However, this gets confusing with equals / hashCode / canEqual, as nothing is generated if any one of those methods is present. Now, if one of equals or hashCode is present but not the other one (or canEqual is present but equals and/or hashCode is missing), a warning is emitted to explain that lombok will not generate any of the equals / hashCode methods, and that you should either write them all yourself or remove them all. Issue #548",Bug fix
BUGFIX: Possibly fixed a race condition in patcher Issue #566.,Bug fix
,
FEATURE: Major performance improvements in eclipse by profiling the project clean process.,Performance improvement
"CHANGE: {Experimental} The experimental @Value feature no longer implies the also experimental @Wither. If you like your @Value classes to make withers, add @Wither to the class right next to @Value.",Code redesign
"FEATURE: {Experimental} Reintroduced onMethod, onConstructor and onParam to @Getter, @Setter, @Wither, and @XArgsConstructor. These parameters allow you to add annotations to the methods/constructors that lombok will generate. This is a workaround feature: The stability of the feature on future versions of javac is not guaranteed, and if a better way to implement this feature is found, this feature's current incarnation will be removed without a reasonable period of deprecation. Documentation on the onX feature",Add support for a new feature
FEATURE: Added support for Log4j v2.0 via @Log4j2 Issue #505,Add support for a new feature
